"Status","Start Time","Stop Time","Duration in ms","Parent Suite","Suite","Sub Suite","Test Class","Test Method","Name","Description"
"passed","Wed Nov 29 16:47:03 GMT 2023","Wed Nov 29 16:48:42 GMT 2023","99063","demoqa","../tests-demoqa/textBoxAndFaker.spec.ts","@Demoqa Text Box Tests","","","TC: Fill out input text fields by data from faker lib",""
"passed","Wed Nov 29 16:46:42 GMT 2023","Wed Nov 29 16:46:51 GMT 2023","9347","client app","ClientAppWithExternalDataAndParametriazation.spec.ts","","","","TC: E2E for ordering iphone 13 pro",""
"passed","Wed Nov 29 16:46:51 GMT 2023","Wed Nov 29 16:47:01 GMT 2023","9790","client app","ClientAppWithExternalDataAndParametriazation.spec.ts","","","","TC: E2E for ordering zara coat 3",""
"passed","Wed Nov 29 16:46:37 GMT 2023","Wed Nov 29 16:46:42 GMT 2023","4964","client app","ClientAppWithExternalDataAndParametriazation.spec.ts","","","","TC: Verify success login to client app with anshika@gmail.com and Iamking@000",""
"passed","Wed Nov 29 16:46:31 GMT 2023","Wed Nov 29 16:46:37 GMT 2023","5572","client app","ClientAppWithExternalDataAndParametriazation.spec.ts","","","","TC: Verify success login to client app with nspprotest@gmail.com and Pl@ywright_test_m1",""
"passed","Wed Nov 29 16:46:30 GMT 2023","Wed Nov 29 16:46:31 GMT 2023","1297","setup","auth.setupNew.spec.ts","","","","authenticate default for client app",""
