"Status","Start Time","Stop Time","Duration in ms","Parent Suite","Suite","Sub Suite","Test Class","Test Method","Name","Description"
"passed","Sun Dec 03 11:00:58 GMT 2023","Sun Dec 03 11:00:59 GMT 2023","1156","setup","auth.setupNew.spec.ts","","","","authenticate default for client app",""
"passed","Sun Dec 03 11:01:31 GMT 2023","Sun Dec 03 11:01:38 GMT 2023","7107","demoqa","../tests-demoqa/textBoxAndFaker.spec.ts","@Demoqa Text Box Tests","","","TC 1: Fill out input text fields by data from faker lib",""
"passed","Sun Dec 03 11:00:59 GMT 2023","Sun Dec 03 11:01:08 GMT 2023","8518","client app","ClientAppWithExternalDataAndParametriazation.spec.ts","","","","TC: Verify success login to client app with nspprotest@gmail.com and Pl@ywright_test_m1",""
"passed","Sun Dec 03 11:01:13 GMT 2023","Sun Dec 03 11:01:21 GMT 2023","8100","client app","ClientAppWithExternalDataAndParametriazation.spec.ts","","","","TC: E2E for ordering iphone 13 pro",""
"passed","Sun Dec 03 11:01:08 GMT 2023","Sun Dec 03 11:01:13 GMT 2023","4862","client app","ClientAppWithExternalDataAndParametriazation.spec.ts","","","","TC: Verify success login to client app with anshika@gmail.com and Iamking@000",""
"passed","Sun Dec 03 11:01:21 GMT 2023","Sun Dec 03 11:01:30 GMT 2023","8843","client app","ClientAppWithExternalDataAndParametriazation.spec.ts","","","","TC: E2E for ordering zara coat 3",""
"failed","Sun Dec 03 11:02:20 GMT 2023","Sun Dec 03 11:02:30 GMT 2023","9755","demoqa","../tests-demoqa/textBoxKeysAndShort.spec.ts","@Demoqa Text Box Tests","","","TC 3: E2E. Enter and remove data from input text fields and via keys and shortcuts",""
"passed","Sun Dec 03 11:01:38 GMT 2023","Sun Dec 03 11:01:50 GMT 2023","12109","demoqa","../tests-demoqa/textBoxKeysAndShort.spec.ts","@Demoqa Text Box Tests","","","TC 2: E2E. Enter and remove data from input text fields and via keys and shortcuts and cycle",""
